match_weight,match_probability,source_dataset_l,source_dataset_r,uid_l,uid_r,state_l,state_r,gamma_state,city_l,city_r,gamma_city,zip5_l,zip5_r,gamma_zip5,name_l,name_r,gamma_name,address_l,address_r,gamma_address,rank_within_left,match_key,ensemble_score,hybrid_score
20.435998436287218,0.9999992950615924,A,B,A_362,B_362,OR,OR,1.0,ONTARIO,ONTARIO,1.0,97914,97914,1.0,ONTARIO AQUATIC CENTER RENOVATION REBID,ONTARIO AQUATIC CENTER RENOVATION,3.0,,,4.0,1,,1.0,0.9999996475307962
20.13582489404038,0.9999991320147552,A,B,A_193,B_193,ON,ON,1.0,BRIGHTON,BRIGHTON,1.0,0,0,1.0,BRIGHTON WASTEWATER TREATMENT SYSTEM UPGRADES,BRIGHTON WASTEWATER TREATMENT SYSTEM UPGRADES,4.0,,,4.0,1,,1.0,0.9999995660073776
20.13582489404038,0.9999991320147552,A,B,A_168,B_168,WY,WY,1.0,MEETEETSE,MEETEETSE,1.0,82433,82433,1.0,WEST TIMBER AND ROSE CREEKS FISH PASSAGE RESTORATION,WEST TIMBER AND ROSE CREEKS FISH PASSAGE RESTORATION,4.0,,,4.0,1,,1.0,0.9999995660073776
20.13582489404038,0.9999991320147552,A,B,A_634,B_634,ON,ON,1.0,TORONTO,TORONTO,1.0,9,9,1.0,EATONVILLE LIBRARY YOUTH HUB,EATONVILLE LIBRARY YOUTH HUB,4.0,,,4.0,1,,1.0,0.9999995660073776
20.13582489404038,0.9999991320147552,A,B,A_727,B_727,AL,AL,1.0,GADSDEN,GADSDEN,1.0,35901,35901,1.0,DOWNTOWN STREETSCAPE IMPROVEMENTS,DOWNTOWN STREETSCAPE IMPROVEMENTS,4.0,,,4.0,1,,1.0,0.9999995660073776
20.13582489404038,0.9999991320147552,A,B,A_831,B_831,GA,GA,1.0,LAKELAND,LAKELAND,1.0,31635,31635,1.0,LANIER COUNTY HIGH SCHOOL HEADHOUSE & SHELTER,LANIER COUNTY HIGH SCHOOL HEADHOUSE & SHELTER,4.0,,,4.0,1,,1.0,0.9999995660073776
20.13582489404038,0.9999991320147552,A,B,A_951,B_951,MN,MN,1.0,ROSEAU,ROSEAU,1.0,56751,56751,1.0,RUNWAY 16-34 & TAXIWAYS RECONSTRUCTION,RUNWAY 16-34 & TAXIWAYS RECONSTRUCTION,4.0,,,4.0,1,,1.0,0.9999995660073776
19.250131890975883,0.9999983962665641,A,B,A_665,B_665,WY,WY,1.0,UPTON,UPTON,1.0,82730,82730,1.0,WATER & SEWER REPLACEMENT PROJECT,WATER & SEWER REPLACEMENT PROJECT - PHASE 1.1 AND 1.2,2.0,,,4.0,1,,1.0,0.9999991981332821
16.0667646266215,0.9999854314748834,A,B,A_617,B_617,TX,TX,1.0,LEWISVILLE,LEWISVILLE,1.0,75067,75067,1.0,WATER LINE REPLACEMENT,WATER LINE REPLACEMENT - FY 2020 EAST ALEXANDER LANE AND DICKEY DRIVE,1.0,,,4.0,1,,1.0,0.9999927157374418
16.0667646266215,0.9999854314748834,A,B,A_885,B_885,TX,TX,1.0,LEWISVILLE,LEWISVILLE,1.0,75067,75067,1.0,WALMART SUPERCENTER,WALMART SUPERCENTER #263.2 NEW / FRISCO-REBID,1.0,,,4.0,1,,1.0,0.9999927157374418
8.988852972884597,0.9980355921632855,A,B,A_210,B_210,FL,FL,1.0,NEW PORT RICHEY,NEW PORT RICHEY,1.0,34652,,0.0,GRIFFIN PARK FLOOD ABATEMENT,GRIFFIN PARK FLOOD ABATEMENT PROJECT,3.0,,,4.0,1,,1.0,0.9990177960816428
8.988852972884597,0.9980355921632855,A,B,A_846,B_846,CA,CA,1.0,SAN CLEMENTE,SAN CLEMENTE,1.0,92672,,0.0,CAMINO VERA CRUZ RECYCLED WATER LINE EXTENSION REBID,CAMINO VERA CRUZ RECYCLED WATER LINE EXTENSION,3.0,,,4.0,1,,1.0,0.9990177960816428
8.988852972884597,0.9980355921632855,A,B,A_693,B_693,FL,FL,1.0,VERO BEACH,VERO BEACH,1.0,32967,,0.0,HOBART PARK BASEBALL FIELD IMPROVEMENTS REBID,HOBART PARK BASEBALL FIELD IMPROVEMENTS,3.0,,,4.0,1,,1.0,0.9990177960816428
8.688679430637757,0.9975823378019729,A,B,A_389,B_389,HI,HI,1.0,HONOLULU,HONOLULU,1.0,96814,,0.0,BLAISDELL CENTER REDEVELOPMENT ARENA SEWER REHABILITATION,BLAISDELL CENTER REDEVELOPMENT ARENA SEWER REHABILITATION,4.0,,,4.0,1,,1.0,0.9987911689009865
8.688679430637757,0.9975823378019729,A,B,A_679,B_679,TX,TX,1.0,HARLINGEN,HARLINGEN,1.0,78550,,0.0,GBE COMMERCIAL OFFICES,GBE COMMERCIAL OFFICES,4.0,,,4.0,1,,1.0,0.9987911689009865
8.688679430637757,0.9975823378019729,A,B,A_731,B_731,ON,ON,1.0,FORT ERIE,FORT ERIE,1.0,226,,0.0,GIBSON CENTRE EXPANSION PROJECT,GIBSON CENTRE EXPANSION PROJECT,4.0,,,4.0,1,,1.0,0.9987911689009865
8.688679430637757,0.9975823378019729,A,B,A_613,B_613,ON,ON,1.0,THUNDER BAY,THUNDER BAY,1.0,7,,0.0,DRIVEWAY REPLACEMENTS PICTON/WALKOVER,DRIVEWAY REPLACEMENTS PICTON/WALKOVER,4.0,,,4.0,1,,1.0,0.9987911689009865
8.688679430637757,0.9975823378019729,A,B,A_739,B_739,NV,NV,1.0,GERLACH,GERLACH,1.0,89412,,0.0,GERLACH WASTEWATER EXPANSION PROJECT,GERLACH WASTEWATER EXPANSION PROJECT,4.0,,,4.0,1,,1.0,0.9987911689009865
8.688679430637757,0.9975823378019729,A,B,A_963,B_963,MS,MS,1.0,GULFPORT,GULFPORT,1.0,39501,,0.0,ISIAH FREDERICKS BALLFIELD RENOVATIONS,ISIAH FREDERICKS BALLFIELD RENOVATIONS,4.0,,,4.0,1,,1.0,0.9987911689009865
8.688679430637757,0.9975823378019729,A,B,A_266,B_266,FL,FL,1.0,ST. PETERSBURG,ST. PETERSBURG,1.0,33702,,0.0,RUTLAND PLAZA ACCESS ROAD IMPROVEMENTS,RUTLAND PLAZA ACCESS ROAD IMPROVEMENTS,4.0,,,4.0,1,,1.0,0.9987911689009865
8.688679430637757,0.9975823378019729,A,B,A_188,B_188,NJ,NJ,1.0,TOMS RIVER,TOMS RIVER,1.0,08753,,0.0,PUMP STATION NO. 9 FORCE MAIN REPLACEMENT,PUMP STATION NO. 9 FORCE MAIN REPLACEMENT,4.0,,,4.0,1,,1.0,0.9987911689009865
8.688679430637757,0.9975823378019729,A,B,A_251,B_251,FL,FL,1.0,DUNEDIN,DUNEDIN,1.0,34698,,0.0,PATRICIA AVENUE WATER MAIN REPLACEMENT,PATRICIA AVENUE WATER MAIN REPLACEMENT,4.0,,,4.0,1,,1.0,0.9987911689009865
8.688679430637757,0.9975823378019729,A,B,A_330,B_330,FL,FL,1.0,FORT MYERS BEACH,FORT MYERS BEACH,1.0,33931,,0.0,LYNN HALL MEMORIAL PARK RESTROOM AND SITE IMPROVEMENTS,LYNN HALL MEMORIAL PARK RESTROOM AND SITE IMPROVEMENTS,4.0,,,4.0,1,,1.0,0.9987911689009865
8.688679430637757,0.9975823378019729,A,B,A_277,B_277,ON,ON,1.0,PEMBROKE,PEMBROKE,1.0,8,,0.0,CONCRETE WORKS - 2025,CONCRETE WORKS - 2025,4.0,,,4.0,1,,1.0,0.9987911689009865
8.688679430637757,0.9975823378019729,A,B,A_502,B_502,AB,AB,1.0,FORT MCMURRAY,FORT MCMURRAY,1.0,946,,0.0,FATHER MERCREDI SITE REMEDIATION,FATHER MERCREDI SITE REMEDIATION,4.0,,,4.0,1,,1.0,0.9987911689009865
7.802986427573264,0.9955421374232053,A,B,A_131,B_131,FL,FL,1.0,GULF BREEZE,GULF BREEZE,1.0,32561,,0.0,UNDERGROUND UTILITY CONVERSION - NEIGHBORHOOD COLLECTORS,UNDERGROUND UTILITY CONVERSION - NEIGHBORHOOD COLLECTORS - CITY OF GULF BREEZE,2.0,,,4.0,1,,1.0,0.9977710687116026
7.802986427573264,0.9955421374232053,A,B,A_888,B_888,AK,AK,1.0,ATQASUK,ATQASUK,1.0,99503,,0.0,AREA WIDE SEWAGE LAGOON UPGRADES DUPLICATE REPORT,AREA WIDE SEWAGE LAGOON UPGRADES,2.0,,,4.0,1,,1.0,0.9977710687116026
7.802986427573264,0.9955421374232053,A,B,A_48,B_48,HI,HI,1.0,HONOLULU,HONOLULU,1.0,96843,,0.0,SERVICE LATERAL REPLACEMENTS,SERVICE LATERAL REPLACEMENTS IN PALOLO AREA,2.0,,,4.0,1,,1.0,0.9977710687116026
7.802986427573264,0.9955421374232053,A,B,A_281,B_281,CT,CT,1.0,MILFORD,MILFORD,1.0,06460,,0.0,SEA SHELL RESIDENCES APARTMENT BUILDING,SEA SHELL RESIDENCES,2.0,,,4.0,1,,1.0,0.9977710687116026
20.435998436287218,0.9999992950615924,A,B,A_68,B_68,MN,MN,1.0,ORR,ORR,1.0,55771,55771,1.0,BOIS FORTE SO 3 PHASE 2 DNR OFFICE BUILDING,BOIS FORTE - SO 3 PH 2 DNR OFFICE BUILDING,3.0,,,4.0,1,,0.985449570948887,0.9927244330052396
8.988852972884597,0.9980355921632855,A,B,A_37,B_37,FL,FL,1.0,PEMBROKE PINES,PEMBROKE PINES,1.0,33026,,0.0,"PEDIATRIC ASSOCIATES - PEMBROKE PINES, FL",PEDIATRIC ASSOCIATES / PEMBROKE PINES,3.0,,,4.0,1,,0.9768339768339769,0.9874347844986312
7.802986427573264,0.9955421374232053,A,B,A_955,B_955,TX,TX,1.0,LAREDO,LAREDO,1.0,78045,,0.0,BRENNAN II AT PINNACLE INDUSTRIAL CENTER WAREHOUSE SHELL,BRENNAN II / PINNACLE INDUSTRIAL CENTER WAREHOUSE SHELL,2.0,,,4.0,1,,0.9774568074568074,0.9864994724400064
8.988852972884597,0.9980355921632855,A,B,A_555,B_555,FL,FL,1.0,PANAMA CITY BEACH,PANAMA CITY BEACH,1.0,32407,,0.0,LYNDELL CONFERENCE CENTER RESTROOM & LOBBY RENOVATION,LYNDELL CONFERENCE CENTER RESTROOM AND LOBBY RENOVATION,3.0,,,4.0,1,,0.9721569411547573,0.9850962666590214
19.250131890975883,0.9999983962665641,A,B,A_134,B_134,OK,OK,1.0,TAHLEQUAH,TAHLEQUAH,1.0,74464,74464,1.0,REASOR'S 902 REMODEL TAHLEQUAH OK REBID,REASOR'S #902 REMODEL - TAHLEQUAH,2.0,,,4.0,1,,0.9663865546218486,0.9831924754442063
7.802986427573264,0.9955421374232053,A,B,A_47,B_47,FL,FL,1.0,FERNANDINA BEACH,FERNANDINA BEACH,1.0,32034,,0.0,AMELIA WATERFRONT PARK PAVILION AND RESTROOMS CONSTRUCTION,AMELIA RIVER WATERFRONT PARK PAVILION AND RESTROOMS CONSTRUCTION,2.0,,,4.0,1,,0.9678195048511206,0.9816808211371629
4.6196191632188786,0.9609123259929564,A,B,A_723,B_723,FL,FL,1.0,MIAMI,MIAMI,1.0,33136,,0.0,GALLERY AT RIVERWALK APARTMENTS-RETAIL-PARKING GARAGE,GALLERY AT RIVERWALK,1.0,,,4.0,1,,1.0,0.9804561629964782
7.802986427573264,0.9955421374232053,A,B,A_187,B_187,FL,FL,1.0,PEMBROKE PINES,PEMBROKE PINES,1.0,33024,,0.0,"TACO BELL #21409 (PEMBROKE PINES, FL)",TACO BELL #21409 / PEMBROKE PINES,2.0,,,4.0,1,,0.9604395604395602,0.9779908489313828
20.435998436287218,0.9999992950615924,A,B,A_15,B_15,AB,AB,1.0,CALGARY,CALGARY,1.0,2,2,1.0,SHEPARD WASTE MANAGEMENT FACILITY CELL - CONSTRUCTION,SHEPARD WASTE MANAGEMENT FACILITY CELL 14 EAST CONSTRUCTION,3.0,,,4.0,1,,0.9529904418825035,0.9764948684720479
7.802986427573264,0.9955421374232053,A,B,A_458,B_458,UT,UT,1.0,AMERICAN FORK,AMERICAN FORK,1.0,84003,,0.0,TIMPANOGOS SPECIAL SERVICE DISTRICT WWTP PACKAGE B,TIMPANOGOS SPECIAL SERVICE DISTRICT - PACKAGE B - SITE SECURITY SYSTEM,2.0,,,4.0,1,,0.9558173784977907,0.975679757960498
7.802986427573264,0.9955421374232053,A,B,A_979,B_979,HI,HI,1.0,HONOLULU,HONOLULU,1.0,96818,,0.0,SALT LAKE ELEMENTARY SCHOOL CAFETERIA STAGE IMPROVEMENTS,SALT LAKE ELEMENTARY SCHOOL - CAFETERIA IMPROVEMENTS,2.0,,,4.0,1,,0.9428679163973284,0.9692050269102668
7.802986427573264,0.9955421374232053,A,B,A_269,B_269,CA,CA,1.0,SAN CLEMENTE,SAN CLEMENTE,1.0,92672,,0.0,HOTEL CLEMENTE AND LORETTA'S RESTAURANT,HOTEL CLEMENTE / LORETTAS RESTAURANT,2.0,,,4.0,1,,0.937142857142857,0.9663424972830312
20.435998436287218,0.9999992950615924,A,B,A_881,B_881,WV,WV,1.0,FAYETTEVILLE,FAYETTEVILLE,1.0,25840,25840,1.0,PARKING LOT MILLING PAVING AND STRIPING RESURFACE,"PARKING LOT MILLING, PAVING, AND STRIPING SERVICES",3.0,,,4.0,1,,0.9316888045540797,0.965844049807836
19.250131890975883,0.9999983962665641,A,B,A_775,B_775,IA,IA,1.0,MARSHALLTOWN,MARSHALLTOWN,1.0,50158,50158,1.0,MAIN STREET PAVING RECONSTRUCTION,MAIN STREET RECONSTRUCTION,2.0,,,4.0,1,,0.9267328449434306,0.9633656206049973
7.802986427573264,0.9955421374232053,A,B,A_699,B_699,CA,CA,1.0,INDIO,INDIO,1.0,92203,,0.0,SHADOW HILLS HIGH SCHOOL PHASE 2 - WRESTLING BUILDING REBID,SHADOW HILLS HIGH SCHOOL - PHASE 2 WRESTLING ROOM BUILDING,2.0,,,4.0,1,,0.9305019305019304,0.9630220339625679
7.802986427573264,0.9955421374232053,A,B,A_484,B_484,FL,FL,1.0,NEW PORT RICHEY,NEW PORT RICHEY,1.0,34652,,0.0,CLARIFIER 1 MAIN GEAR DRIVE,CLARIFIER #1 MAIN GEARBOX,2.0,,,4.0,1,,0.9254658385093169,0.9605039879662611
16.0667646266215,0.9999854314748834,A,B,A_729,B_729,PA,PA,1.0,LEWISBURG,LEWISBURG,1.0,17837,17837,1.0,UNION COUNTY BRIDGE NO 3 REPAIR PROJECT,UNION COUNTY BRIDGE NO. 3 REPAIRS: T-522 (HARBERSON ROAD) OVER WHITE DEER CREEK,1.0,,,4.0,1,,0.9152941176470589,0.9576397745609712
16.0667646266215,0.9999854314748834,A,B,A_410,B_410,TX,TX,1.0,WALLER,WALLER,1.0,77484,77484,1.0,WATER DISTRIBUTION SANITARY SEWER DRAINAGE & PAVING,"WATER DISTRIBUTION, SANITARY SEWER AND DRAINAGE FACILITIES TO SERVE MEADOWS AT I",1.0,,,4.0,1,,0.9091438555620268,0.9545646435184552
16.0667646266215,0.9999854314748834,A,B,A_778,B_778,TX,TX,1.0,WALLER,WALLER,1.0,77484,77484,1.0,WATER SANITARY DRAINAGE AND PAVING FACILITIES,"WATER, SANITARY, AND PAVING FACILITIES IN STONECREEK ESTATES SECTION 13",1.0,,,4.0,1,,0.9064493267186392,0.9532173790967613
16.0667646266215,0.9999854314748834,A,B,A_392,B_778,TX,TX,1.0,WALLER,WALLER,1.0,77484,77484,1.0,WATER SANITARY DRAINAGE AND PAVING FACILITIES,"WATER, SANITARY, AND PAVING FACILITIES IN STONECREEK ESTATES SECTION 13",1.0,,,4.0,1,,0.9064493267186392,0.9532173790967613
7.802986427573264,0.9955421374232053,A,B,A_406,B_406,TX,TX,1.0,SOUTH PADRE ISLAND,SOUTH PADRE ISLAND,1.0,78597,,0.0,BUBBA GUMP SHRIMP RESTAURANT,BUBBA GUMP SHRIMP CO RESTAURANT / SOUTH PADRE ISLAND,2.0,,,4.0,1,,0.9081632653061225,0.9518527013646638
7.802986427573264,0.9955421374232053,A,B,A_264,B_264,CA,CA,1.0,SANTA CLARITA,SANTA CLARITA,1.0,91390,,0.0,LARC RANCH WATER PIPELINE & ONSITE PUMP STATION,LARC RANCH WATER PIPELINE PROJECT,2.0,,,4.0,1,,0.8983050847457625,0.9469236110844839
4.6196191632188786,0.9609123259929564,A,B,A_521,B_521,ON,ON,1.0,THOROLD,THOROLD,1.0,2,,0.0,THOROLD MUSEUM AND CULTURAL CENTRE,THOROLD HISTORICAL MUSEUM AND CULTURAL CENTRE,1.0,,,4.0,1,,0.9243697478991596,0.942641036946058
19.250131890975883,0.9999983962665641,A,B,A_51,B_51,NH,NH,1.0,BRENTWOOD,BRENTWOOD,1.0,03833,03833,1.0,WASTEWATER TREATMENT FACILITY IMPROVEMENTS,WASTEWATER TREATMENT FACILITY (WWTF) UPGRADES,2.0,,,4.0,1,,0.8823529411764708,0.9411756687215174
7.802986427573264,0.9955421374232053,A,B,A_790,B_790,ON,ON,1.0,THOROLD,THOROLD,1.0,2,,0.0,LAKEVIEW CEMETERY MAUSOLEUM,LAKEVIEW CEMETERY NEW MAUSOLEUM - T1,2.0,,,4.0,1,,0.873015873015873,0.9342790052195391
16.0667646266215,0.9999854314748834,A,B,A_365,B_365,TX,TX,1.0,DAYTON,DAYTON,1.0,77535,77535,1.0,CONSTRUCTION OF WATER AND SANITARY FACILITIES,"CONSTRUCTION OF THE WATER, SANITARY SEWER, DRAINAGE FACILITIES, DETENTION FACILI",1.0,,,4.0,1,,0.8450502152080345,0.9225178233414589
16.0667646266215,0.9999854314748834,A,B,A_20,B_20,ON,ON,1.0,THUNDER BAY,THUNDER BAY,1.0,,,1.0,WATERFRONT DISTRICT PARKADE STRUCTURAL UPGRADES,WATERFRONT PARKING GARAGE STRUCTURAL UPGRADES,1.0,,,4.0,1,,0.839192546583851,0.9195889890293671
16.0667646266215,0.9999854314748834,A,B,A_570,B_570,ON,ON,1.0,ORANGEVILLE,ORANGEVILLE,1.0,9,9,1.0,TOWNLINE & BROADWAY INTERSECTION & CULVERTS REPLACEMENT,TOWNLINE AND BROADWAY INTERSECTION IMPROVEMENTS AND TOWNLINE OVERFLOW CULVERTS R,1.0,,,4.0,1,,0.82527664531159,0.9126310383932367
16.0667646266215,0.9999854314748834,A,B,A_82,B_82,NJ,NJ,1.0,RIVER VALE,RIVER VALE,1.0,07675,07675,1.0,2025 PAVING PROGRAM,2025 ROAD RESURFACING PROGRAM,1.0,,,4.0,1,,0.8235294117647058,0.9117574216197946
8.988852972884597,0.9980355921632855,A,B,A_843,B_843,FL,FL,1.0,ORLANDO,ORLANDO,1.0,32821,32168,0.0,C-10 CANAL BANK RESTORATION,C-10 CANAL BANK RESTORATION PROJECT,3.0,,,4.0,1,,0.8235294117647058,0.9107825019639957
8.988852972884597,0.9980355921632855,A,B,A_480,B_480,WI,WI,1.0,MADISON,MADISON,1.0,53715,53523,0.0,HAWTHORNE COURT RECONSTRUCTION,HAWTHORNE COURT RECONSTRUCTION - 2026,3.0,,,4.0,1,,0.8235294117647058,0.9107825019639957
8.988852972884597,0.9980355921632855,A,B,A_35,B_35,TX,TX,1.0,VICTORIA,VICTORIA,1.0,77904,77995,0.0,BURLINGTON VICTORIA'S RETAIL VILLAGE TENANT INTERIOR,BURLINGTON VICTORIA'S RETAIL VILLAGE TENANT INTERIOR PACKAGE,3.0,,,4.0,1,,0.8235294117647058,0.9107825019639957
8.988852972884597,0.9980355921632855,A,B,A_897,B_897,SD,SD,1.0,LEAD,LEAD,1.0,57754,82701,0.0,DEADWOOD WATER SUPPLY LINE REPLACEMENT PROJECT,DEADWOOD WATER SUPPLY LINE REPLACEMENT,3.0,,,4.0,1,,0.8235294117647058,0.9107825019639957
8.988852972884597,0.9980355921632855,A,B,A_864,B_864,OR,OR,1.0,HILLSBORO,HILLSBORO,1.0,97124,97048,0.0,HILLSBORO AIRPORT RUNWAY AND TAXIWAY SEALS REBID,HILLSBORO AIRPORT RUNWAY AND TAXIWAY SEALS,3.0,,,4.0,1,,0.8235294117647058,0.9107825019639957
8.988852972884597,0.9980355921632855,A,B,A_595,B_595,TX,TX,1.0,PORT ARTHUR,PORT ARTHUR,1.0,77640,77630,0.0,9TH AVENUE PAVEMENT IMPROVEMENT,9TH AVENUE PAVEMENT IMPROVEMENT PROJECT,3.0,,,4.0,1,,0.8235294117647058,0.9107825019639957
8.988852972884597,0.9980355921632855,A,B,A_744,B_744,FL,FL,1.0,NICEVILLE,NICEVILLE,1.0,32578,36477,0.0,VALPARAISO BLVD DRAINAGE IMPROVEMENTS - COMPLETED,VALPARAISO BLVD DRAINAGE IMPROVEMENTS,3.0,,,4.0,1,,0.8235294117647058,0.9107825019639957
8.988852972884597,0.9980355921632855,A,B,A_980,B_980,TX,TX,1.0,LUFKIN,LUFKIN,1.0,75901,75845,0.0,7 BREW - LUFKIN TX,7 BREW - LUFKIN,3.0,,,4.0,1,,0.8235294117647058,0.9107825019639957
8.988852972884597,0.9980355921632855,A,B,A_598,B_598,OK,OK,1.0,BETHANY,BETHANY,1.0,73008,73742,0.0,RIPPER PARK SWIMMING POOL RENOVATIONS PHASE 2,RIPPER PARK SWIMMING POOL RENOVATIONS PHASE 2B,3.0,,,4.0,1,,0.8235294117647058,0.9107825019639957
8.988852972884597,0.9980355921632855,A,B,A_972,B_972,UT,UT,1.0,PARK CITY,PARK CITY,1.0,84060,84037,0.0,HOMESTAKE ROAD RECONSTRUCTION REBID,HOMESTAKE ROAD RECONSTRUCTION,3.0,,,4.0,1,,0.8235294117647058,0.9107825019639957
8.688679430637757,0.9975823378019729,A,B,A_106,B_106,WA,WA,1.0,PULLMAN,PULLMAN,1.0,99163,83855,0.0,DECANT FACILITY,DECANT FACILITY,4.0,,,4.0,1,,0.8235294117647058,0.9105558747833393
8.688679430637757,0.9975823378019729,A,B,A_875,B_875,OR,OR,1.0,EUGENE,EUGENE,1.0,97401,97405,0.0,WEST 5TH AVENUE & SENECA ROAD WATER QUALITY IMPROVEMENTS,WEST 5TH AVENUE & SENECA ROAD WATER QUALITY IMPROVEMENTS,4.0,,,4.0,1,,0.8235294117647058,0.9105558747833393
8.688679430637757,0.9975823378019729,A,B,A_554,B_554,WI,WI,1.0,DELAVAN,DELAVAN,1.0,53115,53523,0.0,DELAVAN PUBLIC LIBRARY ADDITION AND RENOVATION,DELAVAN PUBLIC LIBRARY ADDITION AND RENOVATION,4.0,,,4.0,1,,0.8235294117647058,0.9105558747833393
8.688679430637757,0.9975823378019729,A,B,A_687,B_687,TN,TN,1.0,MEMPHIS,MEMPHIS,1.0,38126,38116,0.0,GREEN LEAF ORGANIC MARKET + DELI,GREEN LEAF ORGANIC MARKET + DELI,4.0,,,4.0,1,,0.8235294117647058,0.9105558747833393
8.688679430637757,0.9975823378019729,A,B,A_721,B_721,ON,ON,1.0,ST THOMAS,ST THOMAS,1.0,5,0,0.0,TECHNOLOGY TRAIL CONSTRUCTION,TECHNOLOGY TRAIL CONSTRUCTION,4.0,,,4.0,1,,0.8235294117647058,0.9105558747833393
8.688679430637757,0.9975823378019729,A,B,A_604,B_604,TX,TX,1.0,LUBBOCK,LUBBOCK,1.0,79410,79041,0.0,TEXAS TECH UNIVERSITY PLANT GENOME LAB RENOVATION,TEXAS TECH UNIVERSITY PLANT GENOME LAB RENOVATION,4.0,,,4.0,1,,0.8235294117647058,0.9105558747833393
8.688679430637757,0.9975823378019729,A,B,A_138,B_138,NH,NH,1.0,NEWMARKET,NEWMARKET,1.0,03857,03833,0.0,SEPTAGE RECEIVING UPGRADE PHASE 1,SEPTAGE RECEIVING UPGRADE PHASE 1,4.0,,,4.0,1,,0.8235294117647058,0.9105558747833393
8.688679430637757,0.9975823378019729,A,B,A_959,B_959,AZ,AZ,1.0,MESA,MESA,1.0,85212,85138,0.0,GATEWAY COMMERCE CENTER II,GATEWAY COMMERCE CENTER II,4.0,,,4.0,1,,0.8235294117647058,0.9105558747833393
8.688679430637757,0.9975823378019729,A,B,A_956,B_956,AB,AB,1.0,MEDICINE HAT,MEDICINE HAT,1.0,1,0,0.0,ST. FRANCIS XAVIER REPLACEMENT SCHOOL,ST. FRANCIS XAVIER REPLACEMENT SCHOOL,4.0,,,4.0,1,,0.8235294117647058,0.9105558747833393
8.688679430637757,0.9975823378019729,A,B,A_299,B_299,NC,NC,1.0,CAMP LEJEUNE,CAMP LEJEUNE,1.0,28547,28562,0.0,LANDFILL CLOSURE PHASE III,LANDFILL CLOSURE PHASE III,4.0,,,4.0,1,,0.8235294117647058,0.9105558747833393
8.688679430637757,0.9975823378019729,A,B,A_359,B_359,ON,ON,1.0,BRADFORD,BRADFORD,1.0,3,9,0.0,HOLY TRINITY CATHOLIC HIGH SCHOOL ADDITION,HOLY TRINITY CATHOLIC HIGH SCHOOL ADDITION,4.0,,,4.0,1,,0.8235294117647058,0.9105558747833393
8.688679430637757,0.9975823378019729,A,B,A_315,B_315,VT,VT,1.0,WATERBURY,WATERBURY,1.0,05676,05443,0.0,LITTLE RIVER STATE PARK ENTRANCE ROAD DRAINAGE IMPROVEMENTS,LITTLE RIVER STATE PARK ENTRANCE ROAD DRAINAGE IMPROVEMENTS,4.0,,,4.0,1,,0.8235294117647058,0.9105558747833393
8.688679430637757,0.9975823378019729,A,B,A_353,B_353,ON,ON,1.0,COBOURG,COBOURG,1.0,9,0,0.0,WELCOME INTERSECTION IMPROVEMENTS,WELCOME INTERSECTION IMPROVEMENTS,4.0,,,4.0,1,,0.8235294117647058,0.9105558747833393
8.688679430637757,0.9975823378019729,A,B,A_443,B_443,TX,TX,1.0,EL PASO,EL PASO,1.0,79912,88021,0.0,MESA HILLS II MULTIFAMILY NEW CONSTRUCTION,MESA HILLS II MULTIFAMILY NEW CONSTRUCTION,4.0,,,4.0,1,,0.8235294117647058,0.9105558747833393
8.688679430637757,0.9975823378019729,A,B,A_231,B_231,TX,TX,1.0,LUBBOCK,LUBBOCK,1.0,79411,79041,0.0,CDBG - MINOR REHAB,CDBG - MINOR REHAB,4.0,,,4.0,1,,0.8235294117647058,0.9105558747833393
8.688679430637757,0.9975823378019729,A,B,A_245,B_245,NY,NY,1.0,LAKE PLACID,LAKE PLACID,1.0,12946,12852,0.0,MT VAN HOEVENBERG SLIDING TRACK MODERNIZATION,MT VAN HOEVENBERG SLIDING TRACK MODERNIZATION,4.0,,,4.0,1,,0.8235294117647058,0.9105558747833393
8.688679430637757,0.9975823378019729,A,B,A_89,B_89,TN,TN,1.0,KNOXVILLE,KNOXVILLE,1.0,37921,37912,0.0,SOUTH KNOX MINI-BASIN 40F3 WATER AND WASTEWATER UPGRADES,SOUTH KNOX MINI-BASIN 40F3 WATER AND WASTEWATER UPGRADES,4.0,,,4.0,1,,0.8235294117647058,0.9105558747833393
8.688679430637757,0.9975823378019729,A,B,A_26,B_26,ON,ON,1.0,OSHAWA,OSHAWA,1.0,171,0,0.0,KINSMEN CIVIC MEMORIAL STADIUM REDEVELOPMENT,KINSMEN CIVIC MEMORIAL STADIUM REDEVELOPMENT,4.0,,,4.0,1,,0.8235294117647058,0.9105558747833393
8.688679430637757,0.9975823378019729,A,B,A_422,B_422,WA,WA,1.0,YAKIMA,YAKIMA,1.0,98901,98848,0.0,YTC 872 MOV PARKING REPAIR,YTC 872 MOV PARKING REPAIR,4.0,,,4.0,1,,0.8235294117647058,0.9105558747833393
8.688679430637757,0.9975823378019729,A,B,A_46,B_46,IL,IL,1.0,URBANA,URBANA,1.0,61802,61849,0.0,KICKAPOO RAIL TRAIL TRAILHEAD PAVILION,KICKAPOO RAIL TRAIL TRAILHEAD PAVILION,4.0,,,4.0,1,,0.8235294117647058,0.9105558747833393
8.688679430637757,0.9975823378019729,A,B,A_523,B_523,WA,WA,1.0,BELLINGHAM,BELLINGHAM,1.0,98225,98266,0.0,BELLINGHAM SHIPPING TERMINAL PORTABLE BARGE RAMP,BELLINGHAM SHIPPING TERMINAL PORTABLE BARGE RAMP,4.0,,,4.0,1,,0.8235294117647058,0.9105558747833393
8.688679430637757,0.9975823378019729,A,B,A_289,B_289,TX,TX,1.0,WAXAHACHIE,WAXAHACHIE,1.0,75165,76631,0.0,COLEMAN JUNIOR HIGH TRACK AND FIELD,COLEMAN JUNIOR HIGH TRACK AND FIELD,4.0,,,4.0,1,,0.8235294117647058,0.9105558747833393
8.688679430637757,0.9975823378019729,A,B,A_211,B_211,UT,UT,1.0,HYRUM,HYRUM,1.0,84319,84308,0.0,LIBBIE SPRINGS PARK,LIBBIE SPRINGS PARK,4.0,,,4.0,1,,0.8235294117647058,0.9105558747833393
8.688679430637757,0.9975823378019729,A,B,A_648,B_648,TN,TN,1.0,RIPLEY,RIPLEY,1.0,38063,72315,0.0,RIPLEY HWY 209 SEWER FORCE MAIN,RIPLEY HWY 209 SEWER FORCE MAIN,4.0,,,4.0,1,,0.8235294117647058,0.9105558747833393
8.688679430637757,0.9975823378019729,A,B,A_501,B_501,WA,WA,1.0,ASOTIN,ASOTIN,1.0,99402,97828,0.0,ASOTIN HIGH SCHOOL CLASSROOM RENOVATION,ASOTIN HIGH SCHOOL CLASSROOM RENOVATION,4.0,,,4.0,1,,0.8235294117647058,0.9105558747833393
8.688679430637757,0.9975823378019729,A,B,A_83,B_83,KY,KY,1.0,NICHOLASVILLE,NICHOLASVILLE,1.0,40356,40342,0.0,BRANNON ROAD WIDENING WATER LINE RELOCATION,BRANNON ROAD WIDENING WATER LINE RELOCATION,4.0,,,4.0,1,,0.8235294117647058,0.9105558747833393
8.688679430637757,0.9975823378019729,A,B,A_230,B_230,TN,TN,1.0,JASPER,JASPER,1.0,37347,37376,0.0,MARION COUNTY HEALTH DEPARTMENT RENOVATIONS,MARION COUNTY HEALTH DEPARTMENT RENOVATIONS,4.0,,,4.0,1,,0.8235294117647058,0.9105558747833393
8.688679430637757,0.9975823378019729,A,B,A_259,B_259,TX,TX,1.0,LUFKIN,LUFKIN,1.0,75901,75845,0.0,ANGELINA WATER SUPPLY CORPORATION - NEW WATER PLANT,ANGELINA WATER SUPPLY CORPORATION - NEW WATER PLANT,4.0,,,4.0,1,,0.8235294117647058,0.9105558747833393
8.688679430637757,0.9975823378019729,A,B,A_175,B_175,MT,MT,1.0,COLSTRIP,COLSTRIP,1.0,59323,59038,0.0,2025 COLSTRIP CRACK AND CHIP SEALING,2025 COLSTRIP CRACK AND CHIP SEALING,4.0,,,4.0,1,,0.8235294117647058,0.9105558747833393
8.688679430637757,0.9975823378019729,A,B,A_215,B_215,FL,FL,1.0,GAINESVILLE,GAINESVILLE,1.0,32601,32091,0.0,AUTOMOTIVE TECHNOLOGY AND TRAINING CENTER,AUTOMOTIVE TECHNOLOGY AND TRAINING CENTER,4.0,,,4.0,1,,0.8235294117647058,0.9105558747833393
8.688679430637757,0.9975823378019729,A,B,A_918,B_918,ON,ON,1.0,SARNIA,SARNIA,1.0,7,0,0.0,MICHIGAN FORCEMAIN AND WATERMAIN,MICHIGAN FORCEMAIN AND WATERMAIN,4.0,,,4.0,1,,0.8235294117647058,0.9105558747833393
8.688679430637757,0.9975823378019729,A,B,A_905,B_905,ON,ON,1.0,BURLINGTON,BURLINGTON,1.0,721,3,0.0,THE RESIDENCES ON CUMBERLAND,THE RESIDENCES ON CUMBERLAND,4.0,,,4.0,1,,0.8235294117647058,0.9105558747833393
4.6196191632188786,0.9609123259929564,A,B,A_71,B_71,IN,IN,1.0,LA PORTE,LA PORTE,1.0,46350,,0.0,HUDSON & SAUGANY LAKE WASTEWATER SYSTEM (WITH PS ) PHI REBID,HUDSON & SAUGANY LAKE WASTEWATER SYSTEM - PHASE I CONTRACT B SAUGANY LAKE WASTEW,1.0,,,4.0,1,,0.8597402597402598,0.910326292866608
7.802986427573264,0.9955421374232053,A,B,A_304,B_304,FL,FL,1.0,TAMPA,TAMPA,1.0,33602,33811,0.0,DOMO AT CASS SQUARE RESIDENTIAL,DOMO AT CASS SQUARE,2.0,,,4.0,1,,0.8235294117647058,0.9095357745939556
7.802986427573264,0.9955421374232053,A,B,A_326,B_326,ON,ON,1.0,BELLEVILLE,BELLEVILLE,1.0,8,0,0.0,BAY DRIVE AREA WATERMAIN INTERCONNECTIONS,BAY DRIVE AREA WATERMAIN INTERCONNECTIONS AND DUNDAS ST E WATERMAIN DECOMMISSION,2.0,,,4.0,1,,0.8235294117647058,0.9095357745939556
7.802986427573264,0.9955421374232053,A,B,A_288,B_288,FL,FL,1.0,JACKSONVILLE,JACKSONVILLE,1.0,32202,32091,0.0,PANDA EXPRESS CHINESE KITCHEN,PANDA EXPRESS CHINESE KITCHEN RENOVATION / JACKSONVILLE,2.0,,,4.0,1,,0.8235294117647058,0.9095357745939556
7.802986427573264,0.9955421374232053,A,B,A_710,B_710,WA,WA,1.0,SPOKANE,SPOKANE,1.0,99208,83804,0.0,PROVIDENCE HOLY FAMILY HOSPITAL,PROVIDENCE HOLY FAMILY HOSPITAL RENOVATION PHASE I TO V,2.0,,,4.0,1,,0.8235294117647058,0.9095357745939556
7.802986427573264,0.9955421374232053,A,B,A_167,B_167,NV,NV,1.0,HENDERSON,HENDERSON,1.0,89015,89002,0.0,VAN WAGENEN STREET IMPROVEMENTS,VAN WAGENEN STREET IMPROVEMENTS LAKE MEAD PKWY TO GREENWAY RD,2.0,,,4.0,1,,0.8235294117647058,0.9095357745939556
7.802986427573264,0.9955421374232053,A,B,A_321,B_321,CO,CO,1.0,HOLYOKE,HOLYOKE,1.0,80734,69127,0.0,HOLYOKE MUNICIPAL AIRPORT REHABILITATION,HOLYOKE MUNICIPAL AIRPORT,2.0,,,4.0,1,,0.8235294117647058,0.9095357745939556
7.802986427573264,0.9955421374232053,A,B,A_899,B_899,CO,CO,1.0,PUEBLO,PUEBLO,1.0,81003,81069,0.0,ASPHALT AND UTILITY IMPROVEMENTS - NORTHERN AVENUE,ASPHALT AND UTILITY IMPROVEMENTS - NORTHERN AVENUE (PRAIRIE TO I-25),2.0,,,4.0,1,,0.8235294117647058,0.9095357745939556
7.802986427573264,0.9955421374232053,A,B,A_997,B_997,MO,MO,1.0,MARYLAND HEIGHTS,MARYLAND HEIGHTS,1.0,63017,62014,0.0,RIVER VALLEY COMMERCE CENTER BUILDING 1,RIVER VALLEY COMMERCE CENTER,2.0,,,4.0,1,,0.8235294117647058,0.9095357745939556
7.802986427573264,0.9955421374232053,A,B,A_588,B_588,TX,TX,1.0,SAN ANTONIO,SAN ANTONIO,1.0,78223,78113,0.0,UNION PARK APARTMENTS REHABILITATION,UNION PARK APARTMENTS,2.0,,,4.0,1,,0.8235294117647058,0.9095357745939556
7.802986427573264,0.9955421374232053,A,B,A_551,B_551,FL,FL,1.0,JACKSONVILLE,JACKSONVILLE,1.0,32218,32091,0.0,WATER MAIN AND FORCE MAIN EXTENSIONS,WATER MAIN AND FORCE MAIN EXTENSIONS ON LEM TURNER ROAD,2.0,,,4.0,1,,0.8235294117647058,0.9095357745939556
